{
  "$schema": "../schema.json",
  "meta": {
    "industry_id": "real_estate",
    "industry_name": "不動産",
    "version": "0.1.0",
    "updated": "2026-07-23",
    "map_style": "flow",
    "description": "不動産業界。総合デベロッパーから分譲・流通・管理・不動産テックまでの分類カオスマップ。建設マップ・データセンターマップと直結。",
    "tagline": "都心再開発・タワマン・データセンター用地 — 土地に流れ込むマネー",
    "editorial_note": "v1は公開情報ベース。分類は編集部整理。J-REITは市場区分が異なるため本マップの対象外(将来追加)。上場情報はJPX上場銘柄一覧(2026-06)と突合済み。",
    "guide": {
      "earn": "デベロッパーは用地取得・開発(先行投資)後、分譲なら売却益、賃貸なら賃料(継続収入)で回収する。REITへの物件売却も出口の定番。金利と地価に業績が連動する。",
      "watch": "業態別くくり。開発・仲介・管理・REITで「一時金型」か「継続収入型」かというビジネスモデルの違いを見比べよう。",
      "talk": "『分譲は一時金型、賃貸・管理は継続収入型』というビジネスモデルの違いから、金利や地価にどう影響を受けるかを踏まえて志望部門を語ると解像度が高い。"
    }
  },
  "layers": [
    {
      "id": "user",
      "label": "入居者・購入者",
      "order": 1,
      "icon": "🧑",
      "description": "住む人・借りる企業"
    },
    {
      "id": "category",
      "label": "事業モデル",
      "order": 2,
      "icon": "🏙️",
      "description": "事業モデル別の分類"
    },
    {
      "id": "deep",
      "label": "川上・川下(深掘り)",
      "order": 90,
      "icon": "⛏"
    }
  ],
  "nodes": [
    {
      "id": "user",
      "role": "入居者・購入者(個人・企業)",
      "layer": "user",
      "description": "家賃・分譲代金・オフィス賃料の払い手。住宅ローン金利が需要を左右する。",
      "map": {
        "ring": 0,
        "angle": 0
      },
      "note": "需要側は個別掲載しない。住宅ローンは銀行マップ参照",
      "companies": [],
      "updated": "2026-07-23",
      "icon": "🧑"
    },
    {
      "id": "developer",
      "role": "総合デベロッパー",
      "layer": "category",
      "description": "オフィス・商業・住宅の複合開発。都心再開発とデータセンター用地で存在感。",
      "map": {
        "ring": 1,
        "angle": 0
      },
      "related_industry": "datacenter",
      "companies": [
        {
          "name": "三井不動産",
          "listing": {
            "market": "東証プライム",
            "code": "8801"
          },
          "financials": {
            "revenue_oku_jpy": 27097,
            "market_cap_oku_jpy": 42882,
            "as_of": "2026-07-06",
            "note": "営業収益=2026年3月期実績(決算短信)、時価総額=2026-07-06時点"
          },
          "salary": {
            "man_jpy": 1855,
            "fy": "2026年3月期"
          }
        },
        {
          "name": "三菱地所",
          "listing": {
            "market": "東証プライム",
            "code": "8802"
          },
          "financials": {
            "revenue_oku_jpy": 17461,
            "market_cap_oku_jpy": 51768,
            "as_of": "2026-07-06",
            "note": "営業収益=2026年3月期実績(決算短信)、時価総額=2026-07-06時点"
          },
          "salary": {
            "man_jpy": 1759,
            "fy": "2026年3月期"
          }
        },
        {
          "name": "住友不動産",
          "listing": {
            "market": "東証プライム",
            "code": "8830"
          }
        },
        {
          "name": "東急不動産ホールディングス",
          "listing": {
            "market": "東証プライム",
            "code": "3289"
          }
        },
        {
          "name": "野村不動産ホールディングス",
          "listing": {
            "market": "東証プライム",
            "code": "3231"
          }
        },
        {
          "name": "ヒューリック",
          "listing": {
            "market": "東証プライム",
            "code": "3003"
          }
        },
        {
          "name": "東京建物",
          "listing": {
            "market": "東証プライム",
            "code": "8804"
          }
        },
        {
          "name": "平和不動産",
          "listing": {
            "market": "東証プライム",
            "code": "8803"
          }
        },
        {
          "name": "いちご",
          "listing": {
            "market": "東証プライム",
            "code": "2337"
          }
        },
        {
          "name": "京阪神ビルディング",
          "listing": {
            "market": "東証プライム",
            "code": "8818"
          },
          "note": "データセンター向け不動産"
        },
        {
          "name": "空港施設",
          "listing": {
            "market": "東証スタンダード",
            "code": "8864"
          }
        },
        {
          "name": "テーオーシー",
          "listing": {
            "market": "東証スタンダード",
            "code": "8841"
          }
        },
        {
          "name": "地主",
          "listing": {
            "market": "東証プライム",
            "code": "3252"
          },
          "note": "底地特化"
        },
        {
          "name": "イントランス",
          "listing": {
            "market": "東証グロース",
            "code": "3237"
          },
          "note": "再生・開発"
        },
        {
          "name": "トラストホールディングス",
          "listing": {
            "market": "東証スタンダード",
            "code": "3286"
          },
          "note": "底地・ホテル"
        },
        {
          "name": "ファーストブラザーズ",
          "listing": {
            "market": "東証スタンダード",
            "code": "3454"
          },
          "note": "不動産投資"
        },
        {
          "name": "ウェルス・マネジメント",
          "listing": {
            "market": "東証スタンダード",
            "code": "3772"
          },
          "note": "ホテル開発投資"
        },
        {
          "name": "リアルゲイト",
          "listing": {
            "market": "東証グロース",
            "code": "5532"
          },
          "note": "オフィスリノベーション"
        },
        {
          "name": "JALCOホールディングス",
          "listing": {
            "market": "東証スタンダード",
            "code": "6625"
          },
          "note": "不動産貸付・アミューズ"
        },
        {
          "name": "RISE",
          "listing": {
            "market": "東証スタンダード",
            "code": "8836"
          }
        },
        {
          "name": "ランドビジネス",
          "listing": {
            "market": "東証スタンダード",
            "code": "8944"
          },
          "note": "オフィスビル"
        },
        {
          "name": "コロンビア・ワークス",
          "listing": {
            "market": "東証スタンダード",
            "code": "146A"
          },
          "note": "開発"
        },
        {
          "name": "宮越ホールディングス",
          "listing": {
            "market": "東証プライム",
            "code": "6620"
          },
          "note": "中国・深セン開発"
        },
        {
          "name": "グローム・ホールディングス",
          "listing": {
            "market": "東証グロース",
            "code": "8938"
          },
          "note": "医療・ヘルスケア不動産"
        },
        {
          "name": "REVOLUTION",
          "listing": {
            "market": "東証スタンダード",
            "code": "8894"
          },
          "note": "買取再販・不動産クラファン"
        }
      ],
      "updated": "2026-07-24",
      "icon": "🏙️",
      "market_size": {
        "oku_jpy": 588245,
        "label": "不動産業 売上高(法人企業統計)",
        "as_of": "2024年度",
        "source": {
          "url": "https://www.mof.go.jp/pri/reference/ssc/results/data.htm",
          "publisher": "財務省"
        }
      }
    },
    {
      "id": "condo_developer",
      "role": "マンション・戸建分譲",
      "layer": "category",
      "description": "タワマン価格の高騰が続く分譲市場。パワービルダーは価格訴求で対抗。",
      "map": {
        "ring": 1,
        "angle": 60
      },
      "related_industry": "construction",
      "companies": [
        {
          "name": "オープンハウスグループ",
          "listing": {
            "market": "東証プライム",
            "code": "3288"
          }
        },
        {
          "name": "飯田グループホールディングス",
          "listing": {
            "market": "東証プライム",
            "code": "3291"
          }
        },
        {
          "name": "コスモスイニシア",
          "listing": {
            "market": "東証スタンダード",
            "code": "8844"
          }
        },
        {
          "name": "サンフロンティア不動産",
          "listing": {
            "market": "東証プライム",
            "code": "8934"
          }
        },
        {
          "name": "エスリード",
          "listing": {
            "market": "東証プライム",
            "code": "8877"
          }
        },
        {
          "name": "カチタス",
          "listing": {
            "market": "東証プライム",
            "code": "8919"
          },
          "note": "中古住宅再生"
        },
        {
          "name": "トーセイ",
          "listing": {
            "market": "東証プライム",
            "code": "8923"
          }
        },
        {
          "name": "フージャースホールディングス",
          "listing": {
            "market": "東証プライム",
            "code": "3284"
          }
        },
        {
          "name": "ゴールドクレスト",
          "listing": {
            "market": "東証スタンダード",
            "code": "8871"
          },
          "financials": {
            "market_cap_oku_jpy": 1164,
            "as_of": "2026-06-30",
            "note": "時価総額=JPX時価総額順位表(2026-06-30時点)"
          },
          "salary": {
            "man_jpy": 764,
            "fy": "2026年3月期"
          }
        },
        {
          "name": "明和地所",
          "listing": {
            "market": "東証スタンダード",
            "code": "8869"
          }
        },
        {
          "name": "エスコン",
          "listing": {
            "market": "東証プライム",
            "code": "8892"
          }
        },
        {
          "name": "MIRARTHホールディングス",
          "listing": {
            "market": "東証プライム",
            "code": "8897"
          }
        },
        {
          "name": "グランディハウス",
          "listing": {
            "market": "東証プライム",
            "code": "8999"
          }
        },
        {
          "name": "ファースト住建",
          "listing": {
            "market": "東証スタンダード",
            "code": "8917"
          }
        },
        {
          "name": "フジ住宅",
          "listing": {
            "market": "東証プライム",
            "code": "8860"
          }
        },
        {
          "name": "穴吹興産",
          "listing": {
            "market": "東証スタンダード",
            "code": "8928"
          }
        },
        {
          "name": "ケイアイスター不動産",
          "listing": {
            "market": "東証プライム",
            "code": "3465"
          }
        },
        {
          "name": "サンヨーホームズ",
          "listing": {
            "market": "東証スタンダード",
            "code": "1420"
          }
        },
        {
          "name": "スター・マイカ・ホールディングス",
          "listing": {
            "market": "東証プライム",
            "code": "2975"
          }
        },